{
  "schema_version": "1.0",
  "project_id": "DEMO-FOUR-SEASONS-LETTERS",
  "concept_id": "COVER-B-INK-LETTER",
  "reference_ids": ["DC-02-cover", "DC-05-cover"],
  "core_metaphor": "墨迹在信笺边缘留下四次季节停顿",
  "composition": {"format": "portrait", "focus": "four sparse ink pauses", "title_safe_area": "center-left"},
  "subject": ["paper edge", "four abstract ink pauses"],
  "color": ["paper white", "charcoal", "restrained seal red"],
  "material": ["fine paper grain", "dry ink edge"],
  "lighting": "flat archival light",
  "style_constraints": ["minimal typography-ready background", "letter-like", "no one-to-one copy"],
  "negative_constraints": ["no readable text", "no logo", "no fake handwriting", "no photographic identity"],
  "background_prompt": "Portrait book-cover background with fine paper grain and four sparse charcoal ink pauses near the edge, restrained seal-red accent, clean center-left title zone, no readable text or logo.",
  "editable_text_overlay": {"title": "editable-text-layer", "author": "editable-text-layer", "studio_mark": "editable-text-layer"},
  "version": "v1",
  "evaluation_status": "draft"
}
